සන්නස,කලනි රුවන්පතිරණ​,පියා විදා රණ හසුන් කැලක් සේ,no,0,,,,
සන්නස,කලනි රුවන්පතිරණ​,එන්න තවත් නොරැඳී,no,0,,,,
සන්නස,කලනි රුවන්පතිරණ​,මා සිත් කව ඈ වෙත ගෙන යන්නට,yes,1,මා සිත් කව,මා සිත්,කවිය​,Author states that his mind is similar to a poem
උතුරෙන්,සාගර පලන්සූරිය,ගෙන එයි මිහිරි ගී මඳනල හමන  විට​,no,0,,,,
උතුරෙන්,සාගර පලන්සූරිය,වැටහෙයි නොවැටහුණු සැඟවුණු කරුණු මට​,no,0,,,,
උතුරෙන්,සාගර පලන්සූරිය,නිල් පැහැයක් නැතත් මේ වැලි පොලොවට පිට​,no,0,,,,
උතුරෙන්,සාගර පලන්සූරිය,උදයට පෙනේ පෙනේ බොල් පිනි බිඳු පබලු ඇට​,yes,1,බොල් පිනි බිඳු පබලු ඇට,බොල් පිනි,පබලු ඇට,Droplets are similar to beads
උතුරෙන්,සාගර පලන්සූරිය,බැඳ ඇති විලංගුව පා මිණි සලඹ කොට,yes,1,පා මිණි සලඹ,පාද​,මිණි සලඹ,Legs are related to a bracelet 
උතුරෙන්,සාගර පලන්සූරිය,සලකා වැටෙන එය බැන්දහු ඉදිරි පිට,no,0,,,,
උතුරෙන්,සාගර පලන්සූරිය,මිනිසුන් දකුණෙ මෙන් උතුරෙත් පෙනෙන විට,no,0,,,,
උතුරෙන්,සාගර පලන්සූරිය,සිහියෙන් තුරන් වෙයි හෙට යන දවස මට,no,0,,,,
වැස්ස,එච්.එම්.කුඩලිගම,ගී දේවියට කැප කල දෙවොලකට සම,no,0,,,,
වැස්ස,එච්.එම්.කුඩලිගම,කුටියක සුවඳ දෙයි කළුවැල් කපුරු දුම,no,0,,,,
වැස්ස,එච්.එම්.කුඩලිගම,අද නම් නුවර එලියකි මා වෙසෙන ගම,yes,1,නුවර එලියකි මා වෙසෙන ගම,මා වෙසෙන ගම,නුවර එලිය,Author states that his vilage is similar to Nuwara Eliya on that particular day
වැස්ස,එච්.එම්.කුඩලිගම,මෙ පමණ අලස දවසක් නොදුටුවෙමි මම,no,0,,,,
නූතන කවි,එරන්ද ඉෂාන් උයන්වත්තේ,තරුවකට පෙම් කරන තරමට,no,0,,,,
නූතන කවි,එරන්ද ඉෂාන් උයන්වත්තේ,ඉතිරි කරගත් කඳුලු උල්පත,yes,1,කඳුලු උල්පත,කඳුලු,උල්පත,Tears are related to a fountain
නූතන කවි,එරන්ද ඉෂාන් උයන්වත්තේ,රහසෙ නිම්නට මුදා හල බව,no,0,,,,
නූතන කවි,එරන්ද ඉෂාන් උයන්වත්තේ,ගලන ගඟවත් දන්නෙ නෑ තව,no,0,,,,
සඳත් ගිය පසු නින්දට ,පියුමන්ති ප්‍රියදර්ශනී ,සසර පුරා සෙනෙහෙ සිතින් මා රැකගත් නාකි,no,0,,,,
සඳත් ගිය පසු නින්දට ,පියුමන්ති ප්‍රියදර්ශනී ,අරුතක් දී සෙනෙහෙ අරන් මගේ ලොවට නුඹ වැඩියට​,no,0,,,,
සඳත් ගිය පසු නින්දට ,පියුමන්ති ප්‍රියදර්ශනී ,පතිනි කරන් නුඹේ ලොවේ අලුතින් ජීවය දුන්නට​,no,0,,,,
සඳත් ගිය පසු නින්දට ,පියුමන්ති ප්‍රියදර්ශනී ,දෙපා වඳිමි රන්තරනේ නුඹයි දෙවිඳු මගෙ දෙවොලට​,yes,1, නුඹයි දෙවිඳු මගෙ දෙවොලට, නුඹ, දෙවිඳු,The narator of the poem relate a person(Prince Siddartha) to a God who is in her temple
සඳත් ගිය පසු නින්දට ,පියුමන්ති ප්‍රියදර්ශනී ,කෙලෙසක නම් කැටි කරනුද සෙනෙහස කව්පද වලු,no,0,,,,
සඳත් ගිය පසු නින්දට ,පියුමන්ති ප්‍රියදර්ශනී ,උපමා රූපක මදි මට සම කරන්න නුඹේ නමට,no,0,,,,
සඳත් ගිය පසු නින්දට ,පියුමන්ති ප්‍රියදර්ශනී ,මා ලිය ඒ සිය දහසක් ආදර බර කවි පද මැද,no,0,,,,
සඳත් ගිය පසු නින්දට ,පියුමන්ති ප්‍රියදර්ශනී ,සෙත් කවියයි හිමියනේ නුඹ කියවු සැණින් හිතම නිවන​,yes,1,සෙත් කවියයි හිමියනේ නුඹ,නුඹ,සෙත් කවිය,The narator of the poem relate a person(Prince Siddartha) to a blessing